{
  "$schema": "https://json-schema.org/draft/2020-12/schema",
  "$id": "urn:tabellio:schema:release-operation:v0.1",
  "title": "Tabellio Release Operation",
  "type": "object",
  "additionalProperties": false,
  "required": ["schemaVersion", "repository", "version", "tag", "revision", "pullRequest", "code", "control", "validation", "release", "createdAt", "integrity"],
  "properties": {
    "schemaVersion": { "const": "tabellio-release-operation/v0.1" },
    "repository": {
      "type": "object",
      "additionalProperties": false,
      "required": ["id", "owner", "name"],
      "properties": {
        "id": { "type": "string", "minLength": 1 },
        "owner": { "type": "string", "pattern": "^[A-Za-z0-9_.-]+$" },
        "name": { "type": "string", "pattern": "^[A-Za-z0-9_.-]+$" }
      }
    },
    "version": { "type": "string", "pattern": "^(0|[1-9][0-9]*)\\.(0|[1-9][0-9]*)\\.(0|[1-9][0-9]*)$" },
    "tag": { "type": "string", "pattern": "^v(0|[1-9][0-9]*)\\.(0|[1-9][0-9]*)\\.(0|[1-9][0-9]*)$" },
    "revision": {
      "type": "object",
      "additionalProperties": false,
      "required": ["commit", "parent"],
      "properties": {
        "commit": { "$ref": "#/$defs/oid" },
        "parent": { "$ref": "#/$defs/oid" }
      }
    },
    "pullRequest": {
      "type": "object",
      "additionalProperties": false,
      "required": ["number", "headCommit", "mergeCommit"],
      "properties": {
        "number": { "type": "integer", "minimum": 1 },
        "headCommit": { "$ref": "#/$defs/oid" },
        "mergeCommit": { "$ref": "#/$defs/oid" }
      }
    },
    "code": {
      "type": "object",
      "additionalProperties": false,
      "required": ["remote", "branch"],
      "properties": {
        "remote": { "const": "origin" },
        "branch": { "const": "main" }
      }
    },
    "control": {
      "type": "object",
      "additionalProperties": false,
      "required": ["repository", "intent"],
      "properties": {
        "repository": {
          "type": "object",
          "additionalProperties": false,
          "required": ["id"],
          "properties": { "id": { "type": "string", "minLength": 1 } }
        },
        "intent": { "$ref": "urn:tabellio:schema:control-ref-operation:v0.1" }
      }
    },
    "validation": {
      "type": "object",
      "additionalProperties": false,
      "required": ["runId", "resultVersion", "status", "headCommit"],
      "properties": {
        "runId": { "type": "string", "minLength": 1 },
        "resultVersion": { "$ref": "#/$defs/oid" },
        "status": { "const": "passed" },
        "headCommit": { "$ref": "#/$defs/oid" }
      }
    },
    "release": {
      "type": "object",
      "additionalProperties": false,
      "required": ["title", "notesPath", "notesDigest"],
      "properties": {
        "title": { "type": "string", "minLength": 1 },
        "notesPath": { "type": "string", "minLength": 1 },
        "notesDigest": { "$ref": "#/$defs/sha256" }
      }
    },
    "createdAt": { "type": "string", "format": "date-time" },
    "integrity": {
      "type": "object",
      "additionalProperties": false,
      "required": ["algorithm", "digest"],
      "properties": {
        "algorithm": { "const": "sha256" },
        "digest": { "$ref": "#/$defs/sha256" }
      }
    }
  },
  "$defs": {
    "oid": { "type": "string", "pattern": "^([0-9a-f]{40}|[0-9a-f]{64})$" },
    "sha256": { "type": "string", "pattern": "^[0-9a-f]{64}$" }
  }
}
